volcano;name;wiki;elevation;lat;lon;abstract;photo;eruption_date;eruption_year
http://dbpedia.org/resource/Mount_Iwate;Mount Iwate;http://en.wikipedia.org/wiki/Mount_Iwate;2038;39.8533;141.001;Le mont Iwate (岩手山, Iwate-san) est un stratovolcan du Japon situé dans la préfecture d'Iwate, dans la région du Tōhoku, sur l'île de Honshū. Il fait partie des 100 montagnes célèbres du Japon.;http://commons.wikimedia.org/wiki/Special:FilePath/Mt._Iwate_and_Morioka.jpg?width=300;juillet 1919;1919
http://dbpedia.org/resource/Mount_Iō_(Iōjima);Mount Iō;http://en.wikipedia.org/wiki/Mount_Iō_(Iōjima);703.7;30.7931;130.305;Le mont Iō (硫黄岳, Iō-dake), aussi appelé mont Iwo, est un dôme de lave rhyolitique actif sur l'île de Iō-jima dans la préfecture de Kagoshima au Japon. Il se trouve aux limites du village de Mishima. La montagne est composée de roche felsique non-alcaline et de dépôts pyroclastiques.;http://commons.wikimedia.org/wiki/Special:FilePath/Iojima_Kagoshima_Japan.jpg?width=300;juin 2013;2013
http://dbpedia.org/resource/Mount_Kamui_(Lake_Mashū_caldera);Mount Kamui;http://en.wikipedia.org/wiki/Mount_Kamui_(Lake_Mashū_caldera);857;43.5722;144.561;Le mont Kamui (カムイヌプリ, Kamui-nupuri), aussi appelé Kamuinupuri ou mont Mashū, est un stratovolcan endormi et un cône parasite de la caldeira Mashū (elle-même à l'origine un cône parasite du lac Kussharo) culminant à 857 m d'altitude dans le parc national d'Akan de Hokkaidō au Japon.;http://commons.wikimedia.org/wiki/Special:FilePath/Kamui-nupuri_and_mashu-dake_on_hokkaido_map.jpg?width=300;1080;1080
http://dbpedia.org/resource/Mount_Karisimbi;Mount Karisimbi;http://en.wikipedia.org/wiki/Mount_Karisimbi;4507;-1.50833;29.445;Le mont Karisimbi est un volcan situé sur la frontière séparant le Rwanda de la République démocratique du Congo. Avec une altitude de 4 507 mètres, il est le plus haut sommet des montagnes des Virunga et ses pentes incluses dans le parc national des Volcans abritent quelques-unes des dernières populations sauvages de gorilles au monde.;http://commons.wikimedia.org/wiki/Special:FilePath/Karisimbi2.jpg?width=300;vers 8050 AEC;-8050
http://dbpedia.org/resource/Mount_Kazbek;Mount Kazbek;http://en.wikipedia.org/wiki/Mount_Kazbek;5054;42.6992;44.5183;Le mont Kazbek (en géorgien : ყაზბეგი) est un sommet et volcan endormi culminant à 5 047 mètres d'altitude en Géorgie, près de la frontière avec la Russie. C'est la cinquième plus haute montagne du Caucase et la deuxième de Géorgie après le mont Chkhara. Il est couvert de glaciers et son ascension ne présente que des difficultés moyennes. Il a été gravi pour la première fois le 1er juillet 1868 par Douglas William Freshfield, Adolphus Warburton Moore et Charles Comyns Tucker.;http://commons.wikimedia.org/wiki/Special:FilePath/Mkinvarcveri.jpg?width=300;vers 750 AEC;-750
http://dbpedia.org/resource/Mount_Kenya;Mount Kenya;http://en.wikipedia.org/wiki/Mount_Kenya;5199;-0.150833;37.3075;Le mont Kenya, dont le nom signifie « montagne de l'autruche » chez les Wakamba, l'une des populations vivant à son pied, est le point culminant du Kenya et le deuxième plus haut sommet d'Afrique, derrière le Kilimandjaro. Les plus hautes cimes culminent à 5 199 mètres à la pointe Batian, 5 188 mètres à la pointe Nelion et 4 985 mètres à la pointe Lenana. Il se situe au centre du pays, juste au sud de l'équateur, à approximativement 150 kilomètres au nord-nord-est de la capitale Nairobi. Le mont Kenya est un volcan rouge né il y a environ trois millions d'années de l'ouverture du rift est-africain. Il a été recouvert pendant des millénaires par une importante calotte glaciaire qui a fortement érodé ses pentes et lui a donné ce relief particulier, avec de nombreuses vallées qui descendent du sommet. Il reste aujourd'hui une douzaine de petits glaciers en phase de retrait rapide, malgré des températures souvent négatives, avec un climat très variable au cours des millénaires et des siècles, des saisons et des jours. La montagne demeure une source d'eau essentielle pour une grande partie du pays. Le volcan est découvert par les Européens en 1849 avec Johann Ludwig Krapf. La communauté scientifique reste longtemps circonspecte sur l'existence de neige à ces latitudes et l'existence du mont Kenya n'est confirmée qu'en 1883. La première exploration a lieu en 1887 et le sommet est véritablement vaincu en 1899 par l'équipe d'Halford John Mackinder. Aujourd'hui, de nombreux itinéraires et refuges permettent d'effectuer l'ascension vers les principaux pics. La montagne possède huit étages de végétation entre le bas et le sommet, avec notamment une vaste couronne de forêt. De nombreuses espèces sont endémiques ou très caractéristiques du mont Kenya, comme les lobelias, les séneçons ou les damans du Cap. C'est pourquoi une zone de 715 km2 autour du sommet est protégée par le parc national du mont Kenya, classé au patrimoine mondial de l'UNESCO, et reçoit plus de 15 000 visiteurs par an.;http://commons.wikimedia.org/wiki/Special:FilePath/Mount_Kenya.jpg?width=300;il y a 3.1 à 2.6 millions d'années;-3097979
http://dbpedia.org/resource/Mount_Kerinci;Mount Kerinci;http://en.wikipedia.org/wiki/Mount_Kerinci;3800;-1.69667;101.266;Le Kerinci est le plus haut volcan d'Indonésie et, à 3 805 mètres d'altitude, le point culminant de l'île de Sumatra. C'est l'un des plus actifs du pays au cours des deux derniers siècles. Toutefois, ses éruptions peu violentes en font une destination populaire.;http://commons.wikimedia.org/wiki/Special:FilePath/Mount_Kerinci_from_Kayuaro.jpg?width=300;2020;2020
http://dbpedia.org/resource/Mount_Kilimanjaro;Mount Kilimanjaro;http://en.wikipedia.org/wiki/Mount_Kilimanjaro;5895;-3.07583;37.3533;Le Kilimandjaro ou Kilimanjaro est une montagne située dans le Nord-Est de la Tanzanie et composée de trois volcans : le Shira à l'ouest, culminant à 3 962 mètres d'altitude, le Mawenzi à l'est, s'élevant à 5 149 mètres d'altitude, et le Kibo, le plus récent géologiquement, situé entre les deux autres et dont le pic Uhuru à 5 891,8 mètres d'altitude constitue le point culminant de l'Afrique. Outre cette caractéristique, le Kilimandjaro est connu pour sa calotte glaciaire sommitale en phase de retrait accéléré depuis le début du XXe siècle et qui devrait disparaître totalement d'ici 2030 à 2050. La baisse des précipitations neigeuses qui en est responsable est souvent attribuée au réchauffement climatique mais la déforestation est également un facteur majeur. Ainsi, malgré la création du parc national en 1973 et alors même qu'elle joue un rôle essentiel dans la régulation bioclimatique du cycle de l'eau, la ceinture forestière continue à se resserrer. En effet, la montagne est notamment le berceau des pasteurs maasaï au nord et à l'ouest, qui ont besoin de prairies d'altitude pour faire paître leurs troupeaux, et des cultivateurs wachagga au sud et à l'est, qui cultivent des parcelles toujours plus étendues sur les piémonts, malgré une prise de conscience depuis le début du XXIe siècle. Après la surprise engendrée dans le milieu scientifique avec sa découverte pour les Européens par Johannes Rebmann en 1848, le Kilimandjaro a éveillé l'intérêt des explorateurs comme Hans Meyer et Ludwig Purtscheller qui parviennent au sommet en 1889 accompagnés de leur guide Yohanas Kinyala Lauwo. Par la suite, il a constitué une terre d'évangélisation que se sont disputée catholiques et protestants. Enfin, après plusieurs années de colonisation allemande puis britannique, il a vu l'émergence d'une élite chagga qui a été un pilier dans la naissance d'une identité nationale avec comme point d'orgue l'indépendance du Tanganyika en 1961. Depuis, le Kilimandjaro est devenu une montagne emblématique, évoquée ou représentée dans les arts et symbolisée sur de nombreux produits à vocation commerciale. Elle est très prisée par les milliers de randonneurs qui réalisent son ascension tout en profitant de la grande diversité de sa faune et de sa flore.;http://commons.wikimedia.org/wiki/Special:FilePath/Mount_Kilimanjaro.jpg?width=300;il y a environ 200000 ans;-197979
http://dbpedia.org/resource/Mount_Kujū;Mount Kujū;http://en.wikipedia.org/wiki/Mount_Kujū;1791;33.0817;131.24;Les monts Kujū (九重山, Kujū-san) sont une des 100 montagnes célèbres du Japon. D'une altitude moyenne de 1 700 m, le massif se situe à la limite de Kokonoe et Taketa dans la préfecture d'Ōita. Ils se trouvent dans le parc national d'Aso-Kujū. Il s'agit d'un volcan actif dont la dernière éruption remonte à novembre 1995. Le moine bouddhiste Sokuhi Nyoitsu du XVIIe siècle y a fondé le temple Fukujū-ji.;http://commons.wikimedia.org/wiki/Special:FilePath/Kuju-san.JPG?width=300;1995;1995
http://dbpedia.org/resource/Mount_Kusatsu-Shirane;Mount Kusatsu-Shirane;http://en.wikipedia.org/wiki/Mount_Kusatsu-Shirane;2171;36.6438;138.528;Le mont Kusatsu-Shirane (草津白根山, Kusatsu Shirane-san) est un volcan actif de 2 160 m d'altitude situé dans la préfecture de Gunma, au Japon.;http://commons.wikimedia.org/wiki/Special:FilePath/Mt.Kusatsu-Shirane.JPG?width=300;2018;2018
http://dbpedia.org/resource/Mount_Lamongan;Mount Lamongan;http://en.wikipedia.org/wiki/Mount_Lamongan;1641;-7.979;113.342;Le Lamongan est un stratovolcan d’Indonésie situé entre le massif du Tengger et l’ensemble du Yang-Argopuro. Son point culminant est le Tarub (1 651 m). Il est entouré de 27 maars, d’un diamètre allant de 150 à 700 mètres, certain contenant des lacs de cratères, et de 60 cônes de cendre ou éruptifs. Le cône actuellement actif se trouve à 650 mètres au sud-ouest du Tarub. Les lacs, dont le Ranu Pakis, le Ranu Klakah et le Ranu Bedali, se trouvent sur les flancs Est et Ouest. Les maars secs se trouvent surtout sur le flanc Nord. On ne lui connaît pas d’éruption de maar historique. Le Lamongan a été très actif de 1799, date de sa première éruption historique jusqu’à la fin du XXe siècle.;http://commons.wikimedia.org/wiki/Special:FilePath/Lamongan.jpg?width=300;février 1898;1898
http://dbpedia.org/resource/Mount_Lawu;Mount Lawu;http://en.wikipedia.org/wiki/Mount_Lawu;3265;-7.625;111.192;Le Lawu est un stratovolcan dans la province de Java central en Indonésie. Sa face nord est profondément érodée. Sur son flanc est, on trouve des lacs de cratère et des cônes secondaires. Il y a une zone de fumerolles sur sa face sud, à 2 550 mètres d'altitude.;http://commons.wikimedia.org/wiki/Special:FilePath/Lawu.jpg?width=300;1885;1885
http://dbpedia.org/resource/Mount_Lokon;Mount Lokon;http://en.wikipedia.org/wiki/Mount_Lokon;1580;1.35833;124.792;Le Lokon, en indonésien Gunung Lokon, est un volcan d'Indonésie situé dans le Nord de Sulawesi. Les volcans jumeaux du Lokon et de l'Empung s'élèvent environ 800 mètres au-dessus de la plaine de Tondano. Ils sont parmi les volcans les plus actifs de Sulawesi. Le Lokon, le plus haut des deux sommets ne présente pas de cratère. Le volcan Empung, morphologiquement plus jeune, exhibe un cratère profond de 150 mètres et large de 400 mètres. Sa dernière éruption date du XVIIIe siècle. Cependant, toutes les éruptions importantes sont originaires du Tompaluan, cratère large de 150 × 200 m, situé dans le col entre les deux sommets, occupé entre les éruptions par un lac acide qui dégaze abondamment et dont la dernière éruption importante a commencé en juin 2011.;http://commons.wikimedia.org/wiki/Special:FilePath/Lokon.JPG?width=300;mai 2015;2015
http://dbpedia.org/resource/Mount_Longonot;Mount Longonot;http://en.wikipedia.org/wiki/Mount_Longonot;2776;-0.915278;36.4569;Le mont Longonot, en anglais Mount Longonot, aussi appelé Ol Longot ou Olonongot, est un stratovolcan du Kenya situé au sud-est du lac Naivasha, dans la vallée du Grand Rift. Couronné par une caldeira de douze kilomètres de longueur sur huit de largeur, il culmine à 2 776 mètres d'altitude. Sa dernière éruption remonte aux environs de 1863. Le volcan est éponyme du couvrant ses pentes.;http://commons.wikimedia.org/wiki/Special:FilePath/MtLongonot1.jpg?width=300;1863;1863
http://dbpedia.org/resource/Mount_Makiling;Mount Makiling;http://en.wikipedia.org/wiki/Mount_Makiling;1090;14.13;121.2;Le mont Makiling est un volcan des Philippines situé sur l'île de Luçon et culminant à 1 090 mètres d'altitude. Bien que le volcan n'ait pas connu d'éruption récente, on trouve des mares de boue acides, bouillantes et sulfurées, et des sources chaudes sur ses contreforts septentrionaux, qui ont donné naissance à une importante activité de tourisme thermal près de Los Baños et de Calamba City.;http://commons.wikimedia.org/wiki/Special:FilePath/Makiling.jpg?width=300;durant l'Holocène;-12000
http://dbpedia.org/resource/Mount_Malabar;Mount Malabar;http://en.wikipedia.org/wiki/Mount_Malabar;2343;-7.13;107.65;Le Malabar, en indonésien Gunung Malabar, est un stratovolcan d'Indonésie situé dans l'ouest de Java, au sud de la ville de Bandung.;http://commons.wikimedia.org/wiki/Special:FilePath/COLLECTIE_TROPENMUSEUM_Landschap_met_gezicht_op_de_Goenoeng_Malabar_TMnr_60011494.jpg?width=300;au Pléistocène;-2580000
http://dbpedia.org/resource/Mount_Maru_(Esan);Mount Maru;http://en.wikipedia.org/wiki/Mount_Maru_(Esan);691.1;41.8519;141.092;Le mont Maru (丸山, Maru-yama) est un stratovolcan de la péninsule de Kameda culminant à 691 m d'altitude à Hakodate en Hokkaidō au Japon. Le mont Maru est également appelé Esan Maruyama (恵山丸山) pour le distinguer d'autres monts Maru et en raison de son association avec le proche mont E.;http://commons.wikimedia.org/wiki/Special:FilePath/Esan_Volcano_&_Esan-Maruyama_Volcano,_SRTM-1.jpg?width=300;il y a environ 200000 ans;-197979
http://dbpedia.org/resource/Mount_Meakan;Mount Meakan;http://en.wikipedia.org/wiki/Mount_Meakan;1499;43.3864;144.009;Le mont Meakan (雌阿寒岳, Meakan-dake) est un stratovolcan actif situé dans le parc national d'Akan dans l'île de Hokkaidō au Japon. Culminant à 1 499 m d'altitude, c'est le plus haut sommet du groupe volcanique Akan. Le volcan se compose de neuf cônes qui se chevauchent, issus de la caldeira Akan sur les rives du lac Akan. Le mont Meakan possède un triple cratère à son sommet. Selon son nom et la légende locale, le mont Meakan est le pendant féminin du mont Oakan de l'autre côté du lac Akan. Il y a deux étangs dans le cratère, 赤沼 (Sekinuma, « étang rouge ») et 青沼 (Aonuma, « étang bleu »).;http://commons.wikimedia.org/wiki/Special:FilePath/Mount_Meakan02s10.jpg?width=300;novembre 2008;2008
http://dbpedia.org/resource/Mount_Melbourne;Mount Melbourne;http://en.wikipedia.org/wiki/Mount_Melbourne;2730;-74.35;164.7;Le mont Melbourne est un volcan de l'Antarctique situé en Terre Victoria, face à la mer de Ross et à la baie Terra Nova. Il a été découvert en 1841 par James Clark Ross qui l'a nommé en l'honneur de William Lamb, 2e vicomte de Melbourne et Premier ministre britannique lorsque l'expédition fut entreprise. Le volcan est encore actif et des fumerolles sont présentes sur le rebord méridional du cratère principal ainsi que le long d'une ligne NNE-SSO de part et d'autre du sommet.;http://commons.wikimedia.org/wiki/Special:FilePath/MountMelbourne.jpg?width=300;1892;1892
http://dbpedia.org/resource/Mount_Merapi;Mount Merapi;http://en.wikipedia.org/wiki/Mount_Merapi;2910;-7.54083;110.445;Le Merapi, en indonésien et en javanais Gunung Merapi, est un volcan d'Indonésie situé sur l'île de Java, au nord de la ville de Yogyakarta. Il s'élève de près de 2 900 mètres au-dessus des forêts et des champs. Avec 49 éruptions explosives entre 1548 et 2010, il est considéré comme le volcan le plus actif et le plus dangereux d'Indonésie, produisant de périodiques nuées ardentes. Ses éruptions sont habituellement espacées de 4 ou 5 ans, mais de plus importantes peuvent avoir lieu tous les siècles, comme la dernière survenue en octobre-novembre 2010.;http://en.wikipedia.org/wiki/Special:FilePath/Mount_Merapi_in_2014.jpg?width=300;en cours;2021
http://dbpedia.org/resource/Mount_Merbabu;Mount Merbabu;http://en.wikipedia.org/wiki/Mount_Merbabu;3145;-7.455;110.44;Le Merbabu est un stratovolcan de Java central en Indonésie. Son nom signifie « montagne de cendres » en javanais. Le Merapi encore actif lui est directement adjacent au sud-est. La ville de Salatiga se trouve au nord. Un col de 1 500 m d'altitude relie les deux volcans. Le village de Selo y est situé. Le Merbabu a deux sommets, le Syarif (3 119 m) et le Kenteng Songo (3 145 m). Trois vallées radiales en forme de U s'étendent depuis le sommet de Kenteng Songo vers le nord-ouest, le nord-est et le sud-est. Deux éruptions connues ont eu lieu en 1560 et en 1797. Celle de 1797 a été évaluée 2 : explosive sur l'indice d'explosivité volcanique. Une éruption non confirmée aurait eu lieu en 1570. Les récentes éruptions provenaient d'une fissure nord-nord-ouest-sud-sud-est qui traverse le sommet et a alimenté les abondants flots de lave des cratères de Kopeng et Kajor respectivement sur les flancs nord et sud. On peut faire l'ascension du Merbabu par plusieurs routes à partir du bourg de au nord-ouest et de celui de Selo au sud. L'ascension de Kopeng à Kenteng Songo prend de 8 à 10 heures[réf. souhaitée].;http://commons.wikimedia.org/wiki/Special:FilePath/MerbabuSawah.jpg?width=300;1797;1797
http://dbpedia.org/resource/Mount_Meru_(Tanzania);Mount Meru;http://en.wikipedia.org/wiki/Mount_Meru_(Tanzania);4562.13;-3.24667;36.7483;Le mont Méru est un volcan du Nord de la Tanzanie qui surplombe la ville d'Arusha. Avec 4 565 mètres d'altitude, il est le deuxième plus haut sommet du pays après le Kilimandjaro et le quatrième sommet le plus haut d'Afrique. En forme de fer à cheval ouvert vers l'est, le mont Méru a connu sa dernière éruption en 1910, faisant de lui un volcan toujours considéré comme actif. Mont Méru est son nom traditionnel. Socialist Peak, son nom officiel, lui a été donné dans les premières années de la période socialiste en Tanzanie mais il est aujourd'hui peu utilisé. Il est aussi appelé Black Mountain et Ol Doinyo Orok.;http://commons.wikimedia.org/wiki/Special:FilePath/Mount_Meru,_2012.jpg?width=300;octobre à décembre 1910;1910
http://dbpedia.org/resource/Mount_Mihara;Mount Mihara;http://en.wikipedia.org/wiki/Mount_Mihara;764;34.7244;139.395;Le mont Mihara (三原山, Mihara-yama) est un volcan actif culminant à 758 m d'altitude sur l'île japonaise d'Izu Ōshima. Bien que le volcan soit principalement basaltique, de grandes éruptions se produisent à des intervalles de 100 à 150 ans.;http://commons.wikimedia.org/wiki/Special:FilePath/Izu-Oshima-IMG_4759.jpg?width=300;octobre 1990;1990
http://dbpedia.org/resource/Mount_Mikeno;Mount Mikeno;http://en.wikipedia.org/wiki/Mount_Mikeno;4437;-1.46389;29.4183;Le mont Mikeno est un volcan éteint des montagnes des Virunga en République démocratique du Congo. Culminant à 4 437 mètres d'altitude, il s'agit du deuxième plus haut sommet de la chaîne et du treizième du continent africain. Il doit son nom, qui signifie « pauvre », à l'âpreté de ses pentes qui les rend inhabitables pour l'homme. Elles abritent en revanche quelques-uns des derniers gorilles des montagnes.;http://commons.wikimedia.org/wiki/Special:FilePath/Bukima_Patrol_Post.jpg?width=300;au Pléistocène;-2580000
http://dbpedia.org/resource/Mount_Muhabura;Mount Muhabura;http://en.wikipedia.org/wiki/Mount_Muhabura;4127;-1.38333;29.6667;Le Muhavura, également appelé Muhabura ou Muhavuru, est un volcan situé sur la frontière entre le Rwanda et l'Ouganda.;http://commons.wikimedia.org/wiki/Special:FilePath/GahingaMuhabura.png?width=300;date inconnue;-1000000000
http://dbpedia.org/resource/Mount_Myōkō;Mount Myōkō;http://en.wikipedia.org/wiki/Mount_Myōkō;2454;36.8881;138.117;Le mont Myōkō (妙高山, Myōkō-san) est un stratovolcan actif situé dans la préfecture de Niigata, sur l'île de Honshu au Japon.;http://commons.wikimedia.org/wiki/Special:FilePath/Mt_Myoko_from_Northeast.JPG?width=300;vers 750 AEC;-750
http://dbpedia.org/resource/Mount_Nantai;Mount Nantai;http://en.wikipedia.org/wiki/Mount_Nantai;2486;36.7619;139.494;Le mont Nantai (男体山, Nantaisan) est une montagne du Japon située à Nikkō, sur l'île de Honshū, au nord de l'agglomération de Tokyo. Ce stratovolcan haut de 2 486 mètres fait partie du complexe volcanique des monts Nikkō dans le parc national de Nikkō. Avec le mont Nikkō-Shirane, le mont Nantai est le plus récent édifice volcanique des monts Nikkō dont l'activité a débuté il y a environ 560 000 ans. Les études scientifiques de sa structure géologique, commencées en 1957, ont établi qu'il est apparu il y a environ 23 000 ans et que sa dernière éruption remonte à environ 7 000 ans. Il est classé volcan actif par l'agence météorologique du Japon depuis juin 2017. Depuis sa première ascension connue par le moine bouddhiste Shōdō Shōnin au VIIIe siècle, le volcan Nantai, montagne sacrée du bouddhisme et du shintoïsme, est un lieu de pèlerinage entretenu par les religieux du sanctuaire Futarasan de Nikkō, un site historique inscrit au patrimoine mondial de l'humanité. Des fouilles archéologiques, effectuées à son sommet à la fin du XIXe siècle et au cours du XXe siècle, ont exhumé des vestiges, dont de nombreuses offrandes votives. Parmi ces objets anciens, datant de la fin de l'époque de Nara (710 – 794) à l'époque d'Edo (1603 – 1868), quelques-uns sont classés biens culturels importants du Japon. Bien que moins connu que le mont Fuji, le mont Nantai est aussi classé parmi les 100 montagnes les plus célèbres du Japon.;http://commons.wikimedia.org/wiki/Special:FilePath/Mount_nantai_and_lake_chuzenji.jpg?width=300;vers 9540 AEC;-9540
http://dbpedia.org/resource/Mount_Ngauruhoe;Mount Ngauruhoe;http://en.wikipedia.org/wiki/Mount_Ngauruhoe;2291;-39.1568;175.632;Le mont Ngauruhoe, ou simplement Ngauruhoe, est un volcan de Nouvelle-Zélande situé dans l'île du Nord, entre deux autres volcans : le mont Tongariro au nord-nord-est et le mont Ruapehu au sud-sud-ouest. Avec 2 287 mètres d'altitude, il s'agit en réalité de la plus élevée des bouches éruptives du volcan Tongariro. De forme conique aux pentes très prononcées et couronnées par un cratère sommital, le mont Ngauruhoe a servi de lieux de tournages pour la Montagne du Destin dans la trilogie cinématographique du Seigneur des Anneaux de Peter Jackson.;http://commons.wikimedia.org/wiki/Special:FilePath/Le_Ngauruhoe_et_le_Ruapehu_vus_du_sommet_du_Tongariro.jpg?width=300;1977;1977
http://dbpedia.org/resource/Mount_Norikura;Mount Norikura;http://en.wikipedia.org/wiki/Mount_Norikura;3025.64;36.1064;137.554;Le mont Norikura (乗鞍岳, Norikura-dake) est un stratovolcan du Japon située à la frontière entre la préfecture de Gifu et la préfecture de Nagano, dans le parc national de Chūbu-Sangaku. Il fait partie des 100 montagnes célèbres du Japon.;http://commons.wikimedia.org/wiki/Special:FilePath/Norikuradake_from_Kisokomagatake_7th_2007-4-29.JPG?width=300;vers 050 AEC;-50
http://dbpedia.org/resource/Mount_Ontake;Mount Ontake;http://en.wikipedia.org/wiki/Mount_Ontake;3067;35.8928;137.48;Le mont Ontake (御嶽山, Ontake-san) ou mont Kiso Ontake (木曽御嶽山, Kiso Ontake-san) est un stratovolcan du Japon situé dans le centre de l'île de Honshū, à la frontière entre les préfectures de Gifu et de Nagano, à une centaine de kilomètres au nord-est de Nagoya. Il s'agit du deuxième volcan le plus élevé du Japon avec 3 067 mètres d'altitude, après le mont Fuji, et du seizième sommet de l'archipel par sa hauteur de culminance. Il fait partie des 100 montagnes célèbres du Japon. Dans la culture locale, c'est une montagne sacrée importante.;http://commons.wikimedia.org/wiki/Special:FilePath/Kiso_Ontake.jpg?width=300;décembre 2020;2020
http://dbpedia.org/resource/Mount_Pangrango;Mount Pangrango;http://en.wikipedia.org/wiki/Mount_Pangrango;3019;-6.7773;106.981;Le Pangrango est un stratovolcan endormi situé dans l' (en), dans la province de Java occidental en Indonésie.;http://commons.wikimedia.org/wiki/Special:FilePath/Pangrango_100122-0445_cawi.JPG?width=300;date inconnue;-1000000000
http://dbpedia.org/resource/Mount_Papandayan;Mount Papandayan;http://en.wikipedia.org/wiki/Mount_Papandayan;2666;-7.32;107.73;"Le Papandayan est un volcan situé au sud-est de la ville de Bandung, dans la province de Java occidental en Indonésie. Des fumerolles s'échappent de ses quatre grands cratères actifs. En 1772, une éruption a provoqué l'effondrement du flanc nord-est, causant une avalanche catastrophique de débris qui a fait près de 3 000 morts, et détruit 40 villages. L'éruption a scindé le volcan en deux, et il présente désormais l'apparence d'un double volcan. L'un des pics est appelé Papandayan ; l'autre, mont Puntang. 
";http://commons.wikimedia.org/wiki/Special:FilePath/Indonesia_-_papandayan_4.jpg?width=300;novembre à décembre 2002;2002
