volcano;name;wiki;elevation;lat;lon;abstract;photo;eruption_date;eruption_year
http://dbpedia.org/resource/Ojos_del_Salado;Ojos del Salado;http://en.wikipedia.org/wiki/Ojos_del_Salado;6893;-27.1097;-68.5414;Le Nevado Ojos del Salado est un volcan situé dans les Andes, sur la frontière entre l'Argentine (province de Catamarca) et le Chili (région d'Atacama), constituant le point culminant de ce dernier. Il s'élève à 6 893 mètres d'altitude dans le sud du désert d'Atacama. Il constitue de ce fait le plus haut volcan du monde et donc un des sept sommets volcaniques, mais également un des sept sommets secondaires. Bien que sa dernière éruption ne soit pas connue avec précision, il est considéré comme actif. Son ascension, qui présente peu de difficulté, a été réussie pour la première fois en 1937 par une expédition polonaise.;http://commons.wikimedia.org/wiki/Special:FilePath/Ojos_del_Salado_looming_big_on_the_horizon.jpg?width=300;vers l'an 700 environ;700
http://dbpedia.org/resource/Ol_Doinyo_Lengai;Ol Doinyo Lengai (Oldoinyo Lengai);http://en.wikipedia.org/wiki/Ol_Doinyo_Lengai;3188;-2.76444;35.9161;L'Ol Doinyo Lengaï est un stratovolcan de Tanzanie située dans la vallée du Grand Rift qui parcourt l'Afrique orientale du Nord au Sud. C'est le seul volcan actif de Tanzanie. Ol Doinyo Lengaï est un terme maa, la langue des Masaïs dont elle est la montagne sacrée, qui signifie « Montagne des Dieux » en français. Il fait partie du massif du Ngorongoro et une savane s'étend à ses pieds.;http://en.wikipedia.org/wiki/Special:FilePath/Oldoinyolengai.jpg?width=300;2019;2019
http://dbpedia.org/resource/Olca;Olca;http://en.wikipedia.org/wiki/Olca;5407;-20.9333;-68.4833;L'Olca est un volcan situé sur la frontière entre la Bolivie et le Chili. Mal connu, il est constitué de plusieurs bouches éruptives alignées sur plusieurs kilomètres et ayant émis des coulées de lave jusqu'à cinq kilomètres de longueur.;http://commons.wikimedia.org/wiki/Special:FilePath/Cerro_Aucanquilcha,_Chile,_2016-02-10,_DD_15.JPG?width=300;1867;1867
http://dbpedia.org/resource/Ollagüe;Ollagüe;http://en.wikipedia.org/wiki/Ollagüe;5868;-21.2833;-68.1833;L'Ollagüe ou Oyahué est un volcan situé sur la frontière entre la Bolivie et le Chili qui se présente sous la forme d'un stratovolcan andésitique surmonté d'un dôme de lave dacitique. Son activité volcanique est inconnue bien qu'une éruption soit soupçonnée de s'être produite le 8 décembre 1903.;http://commons.wikimedia.org/wiki/Special:FilePath/Ollague_Volcano_from_Chile.jpg?width=300;il y a environ 65000 ans;-62979
http://dbpedia.org/resource/Orosí_Volcano;Orosí Volcano;http://en.wikipedia.org/wiki/Orosí_Volcano;1659;10.98;-85.4733;L’Orosí est un stratovolcan du Costa Rica composé de quatre cônes imbriqués.;http://commons.wikimedia.org/wiki/Special:FilePath/Orosí.jpg?width=300;il y a environ 3500 ans;-1479
http://dbpedia.org/resource/Osorno_(volcano);Osorno;http://en.wikipedia.org/wiki/Osorno_(volcano);2652;-41.1;-72.4931;L'Osorno est un stratovolcan situé entre la province d'Osorno et celle de Llanquihue, dans la région des Lacs au Chili. D'une altitude de 2 652 mètres, il est le volcan le plus actif dans le sud des Andes chiliennes. Il s'élève à l'est du lac Llanquihue, connu mondialement comme symbole du paysage local. Le volcan domine également le lac de Todos los Santos. Sa dernière éruption date de 1869. Charles Darwin aperçoit l'Osorno, de loin, lors de son second voyage sur le HMS Beagle et il est témoin de son éruption en janvier 1835. Sa première ascension s'est faite en 1848 par Jean Renous.;http://commons.wikimedia.org/wiki/Special:FilePath/Volcan_Osorno.jpg?width=300;1869;1869
http://dbpedia.org/resource/Otake_(Nakanoshima);Otake;http://en.wikipedia.org/wiki/Otake_(Nakanoshima);979;29.8592;129.857;L'Otake (御岳, O-take) est un stratovolcan culminant à 979 mètres d'altitude dans les îles Tokara du Japon. C'est la plus haute montagne de l'île Nakano-shima qui fait partie du village de Toshima du district de Kagoshima de la préfecture de Kagoshima. Étant la plus grande montagne sur une petite île, elle est aussi appelée Nakanoshima et Tokara Fuji en raison de sa forme.;http://commons.wikimedia.org/wiki/Special:FilePath/Nakanoshima_kakou.jpg?width=300;octobre 1944;1944
http://dbpedia.org/resource/Paektu_Mountain;Paektu Mountain;http://en.wikipedia.org/wiki/Paektu_Mountain;2744;42.0056;128.055;Le mont Paektu ou mont Changbai en Chine est le point culminant de l'ensemble de la Corée, à 2 744 mètres d'altitude. C'était un mont sacré pour les Coréens et les Mandchous. En 946, il a été le théâtre d'une des plus fortes éruptions de notre ère. Sa partie chinoise est protégée par la réserve naturelle du mont Changbai qui a été reconnue réserve de biosphère en 1979, et sa partie nord-coréenne par la réserve naturelle du mont Paektu, réserve de biosphère depuis 1989 (1 320 km2). Situé dans une zone inhospitalière, ses abords sont relativement peu peuplés.;http://commons.wikimedia.org/wiki/Special:FilePath/Paektu-san.jpg?width=300;1903;1903
http://dbpedia.org/resource/Paluweh;Paluweh;http://en.wikipedia.org/wiki/Paluweh;875;-8.32917;121.71;Le Rokatenda, aussi appelé Paluweh, Paloe, Palowe, Rusa Raja, Rusa Radja, Nuha Lua ou encore Nusa Kua, en indonésien Gunung Rokatenda, est un volcan d'Indonésie situé dans les petites îles de la Sonde, sur l'île de Palu'e. Il constitue le point culminant de cette île avec 875 mètres d'altitude.;http://commons.wikimedia.org/wiki/Special:FilePath/Paluweh2013labeled.jpg?width=300;2012;2012
http://dbpedia.org/resource/Parinacota_(volcano);Parina Quta;http://en.wikipedia.org/wiki/Parinacota_(volcano);6380;-18.166;-69.142;Le Parinacota est un volcan situé à la frontière bolivo-chilienne dans la région d'Arica et Parinacota au Chili et dans le département d'Oruro en Bolivie dans les Andes. Ce stratovolcan culmine à 6 348 mètres d'altitude. Avec le Pomerape il forme les , anciens dieux pour les habitants de l'altiplano andin tant boliviens que chiliens. Sa première ascension eut lieu le 12 décembre 1928 par le Bolivien Carlos Terán et l'Autrichien Joseph Prem. Un sentier part du village de Parinacota et monte vers 5 000 mètres d'altitude sur le flanc sud-ouest du volcan. Cette randonnée fait environ 35 à 40 kilomètres aller-retour. Les abords de la frontière bolivienne étant minés côté chilien, il est fortement déconseillé de quitter le sentier et recommandé de se renseigner à la CONAF à Putre.;http://commons.wikimedia.org/wiki/Special:FilePath/Parinacota_volcano_chungara_lake_cl.jpg?width=300;vers l'an 290 environ;290
http://dbpedia.org/resource/Patilla_Pata;Patilla Pata;http://en.wikipedia.org/wiki/Patilla_Pata;5324;-18.0611;-69.0567;Le Patilla Pata est un stratovolcan bolivien. La date de sa dernière éruption est inconnue, mais elle est apparemment antérieure à l'Holocene la montagne possédant une importante couche de glace. La composition du volcan est principalement andésitique, mais on trouve également des coulées de lave basaltique.;http://commons.wikimedia.org/wiki/Special:FilePath/AnallajsiNevado.jpg?width=300;date inconnue;-1000000000
http://dbpedia.org/resource/Peinado;Peinado;http://en.wikipedia.org/wiki/Peinado;5740;-26.62;-68.15;Le Peinado encore appelé Cerro Peinado est un stratovolcan actif d'Argentine. Il est situé dans la Puna de la province de Catamarca. Son cône volcanique presque parfait, fait de lui, avec le Lanín beaucoup moins élevé, un des plus beaux exemplaires parmi les nombreux volcans argentins.;http://commons.wikimedia.org/wiki/Special:FilePath/Volcanic_Landscapes,_Central_Andes_labelled.jpg?width=300;date inconnue;-1000000000
http://dbpedia.org/resource/Pico_de_Orizaba;Pico de Orizaba;http://en.wikipedia.org/wiki/Pico_de_Orizaba;5636;19.03;-97.27;Le pic d'Orizaba ou Citlaltépetl est un volcan du Mexique, à la limite entre les États de Veracruz et Puebla. Culminant à 5 675 mètres d'altitude et situé dans la cordillère néovolcanique, il constitue le point culminant du pays et de cette chaîne de montagnes, mais également le plus haut volcan d'Amérique du Nord ce qui en fait un des sept sommets volcaniques. Sa dernière éruption remonte à 1846. Sa première ascension officielle a lieu deux ans plus tard, à la fin de la Guerre américano-mexicaine, par les lieutenants américains F. Maynard et G. Reynolds.;http://commons.wikimedia.org/wiki/Special:FilePath/Pico_from_Fortin_2_enhanced2.jpg?width=300;1846;1846
http://dbpedia.org/resource/Pico_do_Fogo;Pico do Fogo;http://en.wikipedia.org/wiki/Pico_do_Fogo;2829;14.95;-24.3417;Le Pico do Fogo est un stratovolcan situé sur l'île de Fogo, au Cap-Vert, point culminant du pays avec 2 829 m d'altitude.;http://commons.wikimedia.org/wiki/Special:FilePath/Cape_Verde_Pico_do_Fogo_b.jpg?width=300;novembre 2014 à février 2015;2014
http://dbpedia.org/resource/Popocatépetl;Popocatépetl;http://en.wikipedia.org/wiki/Popocatépetl;5426;19.0222;-98.6278;Le Popocatepetl, en espagnol Popocatépetl, est un volcan du Mexique situé à 70 kilomètres au sud-est de Mexico, dans les États de Puebla et de Mexico. Avec 5 426 mètres d'altitude, il est la deuxième plus haute montagne du pays après le pic d'Orizaba, un autre volcan. Une puissante éruption s'est produite du 5 mars 1996 au 22 novembre 2003 et il est en activité depuis le 9 janvier 2005. Bien que faiblement explosives et ayant des conséquences localisées, ses éruptions menacent plusieurs dizaines de millions d'habitants vivant à proximité, notamment dans les agglomérations de Mexico et de Puebla.;http://commons.wikimedia.org/wiki/Special:FilePath/PopoAmeca2zoom.jpg?width=300;2004;2004
http://dbpedia.org/resource/Porak;Porak;http://en.wikipedia.org/wiki/Porak;2800;40.0167;45.7833;Le Porak, aussi appelé Bamni, Mont Bamni ou encore Mont Bam en arménien et Axarbaxar en azéri, est un volcan situé sur le haut-plateau arménien, à cheval entre l'Arménie et l'Azerbaïdjan. Sa dernière éruption aurait facilité la prise d'une ville assiégée par un roi urartéen entre 782 et 773 av. J.-C..;http://commons.wikimedia.org/wiki/Special:FilePath/PorakVolcano.jpg?width=300;vers 778 AEC;-778
http://dbpedia.org/resource/Poás_Volcano;Poás Volcano;http://en.wikipedia.org/wiki/Poás_Volcano;2697;10.2;-84.233;Le Poás est un stratovolcan du Costa Rica. Très actif, il a connu au moins 39 épisodes éruptifs depuis 1828. Il connaît actuellement une activité moyenne (fumerolles, éruptions phréatiques). Situé à 37 km au nord-ouest de la capitale San José, ce volcan culmine à 2 708 m d'altitude. Il est intégré dans le parc national du volcan Poás (Parque Nacional Volcán Poás). Son cratère principal dégage régulièrement des vapeurs sulfurées toxiques et héberge un lac acide qui peut disparaître en fonction de son activité.;http://commons.wikimedia.org/wiki/Special:FilePath/Poas_crater.jpg?width=300;février 2019;2019
http://dbpedia.org/resource/Pular_(volcano);Pular;http://en.wikipedia.org/wiki/Pular_(volcano);6233;-24.1875;-68.0542;Le Pular, littéralement le « sourcil » en , est un stratovolcan du Chili.;http://commons.wikimedia.org/wiki/Special:FilePath/Pular_Volcano_Chile_015.jpg?width=300;date inconnue;-1000000000
http://dbpedia.org/resource/Puntiagudo-Cordón_Cenizos;Puntiagudo-Cordón Cenizos;http://en.wikipedia.org/wiki/Puntiagudo-Cordón_Cenizos;2493;-40.9694;-72.2639;Le Puntiagudo est un volcan du Chili remarquable pour sa cheminée volcanique dégagée par l'érosion et formant un neck sommital.;http://commons.wikimedia.org/wiki/Special:FilePath/DonPedro_Antillanca.jpg?width=300;1850;1850
http://dbpedia.org/resource/Puracé;Puracé;http://en.wikipedia.org/wiki/Puracé;4646;2.31389;-76.3953;Le Puracé est un stratovolcan de Colombie constitué de sept cônes et cratères.;http://commons.wikimedia.org/wiki/Special:FilePath/Volcan_purace.JPG?width=300;mars 1977;1977
http://dbpedia.org/resource/Pyroclastic_Peak;Pyroclastic Peak;http://en.wikipedia.org/wiki/Pyroclastic_Peak;2349;50.1144;-123.293;Le pic Pyroclastic est le deuxième sommet le plus élevé des cinq sommets volcaniques principaux du mont Cayley. Vulcan's Thumb, autre sommet du mont Cayley, se trouve sur son arête sud.;http://commons.wikimedia.org/wiki/Special:FilePath/South_Face_of_Pyroclastic_Peak.jpg?width=300;au Pléistocène;-2580000
http://dbpedia.org/resource/Quetrupillán;Quetrupillán;http://en.wikipedia.org/wiki/Quetrupillán;2360;-39.5;-71.7;Le Quetrupillán est un stratovolcan du Chili situé à la limite entre les régions d'Araucanie et des Fleuves. Il se situe entre le volcan Villarrica situé au nord-ouest et le Lanín situé au sud-est, dans le centre du parc national Villarrica. Il est couronné par une caldeira résultant de l'effondrement de la chambre magmatique.;http://commons.wikimedia.org/wiki/Special:FilePath/Volcanoes_Quetrupillan_and_Lanin.jpg?width=300;juin 1872;1872
http://dbpedia.org/resource/Raoul_Island;Raoul Island;http://en.wikipedia.org/wiki/Raoul_Island;516;-29.2667;-177.917;L'île Raoul, autrefois Sunday Island, est une île néo-zélandaise faisant partie de l'archipel des îles Kermadec dont elle constitue l'île la plus septentrionale et la plus grande. Elle constitue le rebord émergé d'un volcan entré en éruption pour la dernière fois le 17 mars 2006 en faisant un mort et en provoquant l'évacuation de la station météorologique de l'île.;http://commons.wikimedia.org/wiki/Special:FilePath/STS008-36-1403_cropped_rotated.jpg?width=300;mars 2006;2006
http://dbpedia.org/resource/Reventador;Reventador;http://en.wikipedia.org/wiki/Reventador;3562;-0.0775;-77.6558;Le Reventador est un volcan actif d'Équateur culminant à environ 3 660 mètres d'altitude entre les provinces de Sucumbíos et de Napo.;http://commons.wikimedia.org/wiki/Special:FilePath/ElReventador2012.jpg?width=300;2008;2008
http://dbpedia.org/resource/Rota_(volcano);Rota;http://en.wikipedia.org/wiki/Rota_(volcano);832;12.55;-86.75;Rota ou Orota est un volcan situé dans le département de León, dans l'ouest du Nicaragua.;http://commons.wikimedia.org/wiki/Special:FilePath/Rota_volcano.jpg?width=300;date inconnue;-1000000000
http://dbpedia.org/resource/Sabalan;Sabalan;http://en.wikipedia.org/wiki/Sabalan;4791;38.2669;47.8369;Savalan (en Azéri Sāvālān) ou Sabalan (سبلان Sabalân en Persan) est un volcan inactif dans la province d'Ardabil en Iran. Savalan est le troisième sommet d'Iran et un lac permanent s'est formé à son sommet. Savalan possède une station de ski sur ses pentes et différentes attractions touristiques comme les sources d'eau chaude de Sareyn. La montagne est connue pour ses beaux points de vue, dont la gorge de Sirvan, où peu de grimpeurs s'aventurent.;http://commons.wikimedia.org/wiki/Special:FilePath/Savalan.jpg?width=300;peut-être durant l'Holocène;-12000
http://dbpedia.org/resource/Sahand;Sahand;http://en.wikipedia.org/wiki/Sahand;3707;37.7308;46.5;Le Sahand (en persan سهند) est le plus haut sommet de la province d'Azerbaïdjan oriental en Iran.;http://commons.wikimedia.org/wiki/Special:FilePath/Mount-Sahand.jpg?width=300;date inconnue;-1000000000
http://dbpedia.org/resource/Sakurajima;Sakurajima;http://en.wikipedia.org/wiki/Sakurajima;1117;31.5806;130.658;Le Sakurajima (桜島, Sakura-jima) est un volcan du Japon situé dans le sud de l'île de Kyūshū. C'est un des volcans les plus actifs du Japon. Lors de la puissante éruption de 1914, le volcan a cessé d'être une île lorsque de la lave a comblé le détroit qui la séparait de l'île de Kyūshū. Le risque humain est un des plus élevés au Japon car l'activité éruptive du Sakurajima est intense, explosive et le volcan se trouve au milieu de la baie de Kagoshima. Ces conditions font peser un risque constant de nuées ardentes et de tsunamis sur la population qui vit à proximité, notamment la ville de Kagoshima (environ 600 000 habitants) distante de huit kilomètres à vol d'oiseau.;http://commons.wikimedia.org/wiki/Special:FilePath/Sakurajima55.jpg?width=300;1955;1955
http://dbpedia.org/resource/San_Cristóbal_Volcano;San Cristóbal;http://en.wikipedia.org/wiki/San_Cristóbal_Volcano;1745;12.702;-87.004;Le San Cristóbal, en espagnol Volcán San Cristóbal, est un volcan du Nicaragua. Culminant à 1 745 mètres d'altitude, c'est le volcan le plus élevé et l'un des plus actifs du pays. Il domine la municipalité de Chichigalpa, dans le département de Chinandega. Il fait partie d'un complexe volcanique de cinq volcans dont il occupe le centre et qui comprend également le Chonco à l'ouest, le Moyotepe au nord-est ainsi que le Casita et la Pelona à l'est. Le complexe est l'une des 78 zones protégées au Nicaragua. Le San Cristobal rejette en permanence une grande quantité de gaz volcaniques et de vapeur d'eau.;http://commons.wikimedia.org/wiki/Special:FilePath/VolcanSanCristobal1.jpg?width=300;mars 2021;2021
http://dbpedia.org/resource/San_Miguel_(volcano);San Miguel;http://en.wikipedia.org/wiki/San_Miguel_(volcano);2130;13.4317;-88.2714;San Miguel ou San Miguel de la Frontera est une ville du Salvador, dans le département du même nom San Miguel. C'est la plus grande ville de l'est du pays, et a une population estimée à 247 119 habitants en 2013. Elle a été fondée en 1530, mais a déménagé à son emplacement actuel en 1586. Depuis la première moitié du XXe siècle a eu un développement économique important, mais la guerre civile salvadorienne a modifié son économie et la société. Dans cette ville se déroule sur San Miguel Carnaval, la fête la plus importante du Salvador qui se développe dans le mois de Novembre pendant les festivités.;http://commons.wikimedia.org/wiki/Special:FilePath/San_Miguel_(Chaparrastique)_Volcano_El_Salvador.JPG?width=300;mai 2018;2018
http://dbpedia.org/resource/San_Pedro_(Chile_volcano);San Pedro;http://en.wikipedia.org/wiki/San_Pedro_(Chile_volcano);6155;-21.888;-68.391;Le San Pedro est un stratovolcan composite du Chili situé au centre nord du désert d'Atacama, à proximité de la frontière avec la Bolivie.;http://commons.wikimedia.org/wiki/Special:FilePath/Volcán_San_Pedro,_Chile,_2016-02-09,_DD_16.JPG?width=300;1960;1960
http://dbpedia.org/resource/San_Salvador_(volcano);San Salvador Volcano (Quezaltepeque);http://en.wikipedia.org/wiki/San_Salvador_(volcano);1893;13.734;-89.294;Le San Salvador, en nahuatl Quezaltepeque, littéralement « montagne de l'oiseau quetzal », est un volcan du Salvador situé à onze kilomètres du centre de la capitale, San Salvador. Une partie de la ville s'étend sur les flancs du volcan.;http://commons.wikimedia.org/wiki/Special:FilePath/Panoaa8.jpg?width=300;juin à novembre 1917;1917
http://dbpedia.org/resource/San_Vicente_(volcano);San Vicente;http://en.wikipedia.org/wiki/San_Vicente_(volcano);2182;13.595;-88.837;"Le volcan de San Vicente, ou Chinchontepec en nahuatl (« Montagne des deux seins »), est situé au Salvador, dans les départements de San Vicente et de La Paz, à quelques kilomètres de la ville San Vicente. Avec ses 2 182 m d'altitude c'est le second plus haut volcan du Salvador après celui de Santa Ana, sa deuxième pointe culmine à 2 083 m. Sur le versant sud, à la base du volcan, il existe des sources d'eaux thermales connues comme Infernillos (« petit enfer ») et d'où émanent des colonnes de vapeurs d'eau et de soufre. 
";http://commons.wikimedia.org/wiki/Special:FilePath/San_vicente_els.jpg?width=300;date inconnue;-1000000000
http://dbpedia.org/resource/Sangay;Sangay;http://en.wikipedia.org/wiki/Sangay;5286;-2.0025;-78.3408;Le Sangay est un stratovolcan d'Équateur culminant à 5 260 mètres d'altitude, de type strombolien. Il se situe à environ 200 kilomètres au sud de Quito. Recouvert de neige, il a été en éruption constante de 1934 à 2013.;http://commons.wikimedia.org/wiki/Special:FilePath/Sangay2.jpg?width=300;1934;1934
http://dbpedia.org/resource/Santa_Ana_Volcano;Santa Ana Volcano;http://en.wikipedia.org/wiki/Santa_Ana_Volcano;2381;13.853;-89.63;"Le volcan de Santa Ana est situé dans la cordillère d'Apaneca au Salvador, dans le département de Santa Ana, près de la ville de Santa Ana. Il est aussi appelé par son nom nahuatl Ilamatepec. Avec ses 2 381 mètres d'altitude, c'est le plus haut volcan du pays. Son sommet est composé de quatre caldeiras avec un lac au fond du cratère. Une éruption à l'époque Pléistocène produisit une avalanche de débris qui atteignit le Pacifique et créa la péninsule d'Acajutla. Depuis l'arrivée des espagnoles au XVIe siècle on dénombre un grand nombre d'éruptions, très actif le volcan est à l'origine de l'apparition de l'Izalco, du Cerro Verde et des fissures volcaniques nommées San Marcelino. En 1722, ces dernières dérivèrent vers l'est et détruisirent un village. Sa dernière éruption date de 2005, un mélange de cendres, de roches et d'eau bouillante fut projeté sur plus d'un kilomètre et tua deux personnes. 
";http://commons.wikimedia.org/wiki/Special:FilePath/Santa_Ana_Volcano.USAF.C-130.3.jpg?width=300;2005;2005
http://dbpedia.org/resource/Santa_María_(volcano);Santa María, Santiaguito;http://en.wikipedia.org/wiki/Santa_María_(volcano);3772;14.7556;-91.5517;Le Santa María, également appelé par métonymie Santiaguito du nom de son dôme de lave ou encore Gagxanul, est un volcan du Guatemala. Il est en éruption depuis 1922 et produit fréquemment des nuées ardentes et des lahars qui ont entraîné des dégâts matériels et des morts parmi la population qui vit en contrebas.;http://commons.wikimedia.org/wiki/Special:FilePath/Santiaguito_from_Santamaria.jpg?width=300;1922;1922
http://dbpedia.org/resource/Sarychev_Peak;Sarychev Peak;http://en.wikipedia.org/wiki/Sarychev_Peak;1496;48.092;153.2;Le Sarytchev ou pic Sarytchev, en russe вулкан Сарычева (voulkan Sarytcheva), est un volcan de Russie situé dans les îles Kouriles, sur l'île de Matoua. Avec seize éruptions répertoriées, dont la première l'est par les Européens vers 1765 et la dernière l'est en 2009, il constitue l'un des volcans les plus actifs des îles Kouriles. Ses éruptions généralement explosives peuvent être accompagnées de coulées de lave mais il n'est pas considéré comme dangereux, l'île de Matoua étant inhabitée.;http://commons.wikimedia.org/wiki/Special:FilePath/Matua.jpg?width=300;2021;2021
http://dbpedia.org/resource/Semeru;Semeru;http://en.wikipedia.org/wiki/Semeru;3676;-8.108;112.92;Le Semeru, anciennement francisé en Sémérou, en indonésien Gunung Semeru, ou Mahameru est un volcan d'Indonésie, dans la province de Java oriental, dans l'est de Java dont il est le point culminant avec 3 676 mètres d'altitude. Le Semeru a la particularité de produire un petit panache volcanique toutes les 30 minutes environ depuis le début de son éruption commencée en 1967. Comme la majorité des volcans situés sur la ceinture de feu du Pacifique, il s'agit d'un volcan gris. Son nom vient du mont Meru, la montagne mythique de plusieurs religions, axe du monde et séjour des dieux. Le Semeru fait partie du parc national de Bromo-Tengger-Semeru.;http://commons.wikimedia.org/wiki/Special:FilePath/Semeru.jpg?width=300;1967;1967
http://dbpedia.org/resource/Seulawah_Agam;Seulawah Agam;http://en.wikipedia.org/wiki/Seulawah_Agam;1810;5.4475;95.6558;"Le Seulawah Agam, en indonésien Gunung Seulawah Agam, en aceh Gunong Seulawah Agam, est un volcan d'Indonésie situé à Sumatra. 
";http://commons.wikimedia.org/wiki/Special:FilePath/Seulawaih_Agam.jpg?width=300;janvier 1839;1839
http://dbpedia.org/resource/Shiveluch;Shiveluch;http://en.wikipedia.org/wiki/Shiveluch;3307;56.6533;161.362;Le Chiveloutch ou Cheveloutch, en cyrillique Шивелуч ou Шевелуч, est un volcan de Russie situé dans la péninsule du Kamtchatka. C'est l'un des volcans les plus grands et les plus actifs de cette région de Russie.;http://commons.wikimedia.org/wiki/Special:FilePath/Shiveluch_-_10_July_2007_-_iss015e16913_edit.jpg?width=300;1999;1999
http://dbpedia.org/resource/Sierra_Nevada_de_Lagunas_Bravas;Sierra Nevada de Lagunas Bravas;http://en.wikipedia.org/wiki/Sierra_Nevada_de_Lagunas_Bravas;6137;-26.4908;-68.5591;Le massif volcanique de Sierra Nevada (« montagne enneigée ») est un volcan actuellement éteint, d'Argentine (province de Catamarca) et du Chili (région d'Atacama), situé à quelque 23 kilomètres au nord-ouest du volcan El Cóndor, c’est-à-dire à quelque quarante-cinq kilomètres au nord-ouest du col frontalier du Paso de San Francisco. Comme ce dernier, il fait frontière entre les deux pays.;http://commons.wikimedia.org/wiki/Special:FilePath/Sierra-Nevada-de-Lagunas-Bravas.jpg?width=300;date inconnue;-1000000000
http://dbpedia.org/resource/Snæfellsjökull;Snæfellsjökull;http://en.wikipedia.org/wiki/Snæfellsjökull;1446;64.8;-23.7833;Le Snæfellsjökull ['stnaiːfɛlsˌjœkʏtl˳] est un stratovolcan d'Islande surmonté d'une calotte glaciaire qui culmine à 1 446 mètres d'altitude. Il est situé à l'extrémité occidentale de la péninsule de Snæfellsnes.;http://commons.wikimedia.org/wiki/Special:FilePath/Snæfellsjökull_in_the_Morning_(7622876302).jpg?width=300;vers l'an 200 environ;200
http://dbpedia.org/resource/Socompa;Socompa;http://en.wikipedia.org/wiki/Socompa;6051;-24.3959;-68.246;Le Socompa est un stratovolcan endormi, qui se trouve à la frontière entre la région d'Antofagasta au Chili et la province argentine de Salta (département de Los Andes). Son altitude est de 6 051 mètres.;http://commons.wikimedia.org/wiki/Special:FilePath/Socompa_Volcano.jpg?width=300;vers 5250 AEC;-5250
